{"$schema":"https://json-schema.org/draft/2020-12/schema","type":"object","required":["intake_version","status","golden_set_version","catalog_contract_version","catalog_contract_sha256","cases"],"properties":{"intake_version":{"type":"string","minLength":1},"status":{"enum":["AWAITING_AUTHORIZED_EVIDENCE","READY_FOR_INDEPENDENT_REVIEW","UNDER_INDEPENDENT_REVIEW","AWAITING_ADJUDICATION","ADJUDICATED_GOLD","BLOCKED_FOR_INTAKE"]},"golden_set_version":{"type":"string","minLength":1},"catalog_contract_version":{"type":"string","minLength":1},"catalog_contract_sha256":{"type":"string","pattern":"^[A-Fa-f0-9]{64}$|^REPLACE_[A-Z0-9_]+$"},"cases":{"type":"array","minItems":1,"items":{"type":"object","required":["case_id","risk_stratum","bindings_under_review","authorization_status","evidence_location_mode","evidence_snapshot_sha256","reviewer_ids","completed_reviews","review_status"],"properties":{"case_id":{"type":"string","minLength":1},"risk_stratum":{"enum":["A","B","C"]},"bindings_under_review":{"type":"array","minItems":1,"items":{"type":"string","minLength":1}},"authorization_status":{"enum":["PENDING","AUTHORIZED_LOCAL_EVALUATION","BLOCKED"]},"evidence_location_mode":{"enum":["REPOSITORY_FIXTURE","AUTHORIZED_LOCAL_EXTERNAL"]},"evidence_locator":{"type":["string","null"]},"evidence_snapshot_sha256":{"type":"string","pattern":"^[A-Fa-f0-9]{64}$|^REPLACE_[A-Z0-9_]+$"},"reviewer_ids":{"type":"array","maxItems":2,"uniqueItems":true,"items":{"type":"string","minLength":1}},"completed_reviews":{"type":"array","maxItems":2,"uniqueItems":true,"items":{"type":"object","required":["review_id","reviewer_id","case_id","binding_id","evidence_snapshot_sha256"],"properties":{"review_id":{"type":"string","minLength":1},"reviewer_id":{"type":"string","minLength":1},"case_id":{"type":"string","minLength":1},"binding_id":{"type":"string","minLength":1},"evidence_snapshot_sha256":{"type":"string","pattern":"^[A-Fa-f0-9]{64}$"}},"additionalProperties":false}},"adjudicator_id":{"type":["string","null"]},"review_status":{"enum":["AWAITING_AUTHORIZED_EVIDENCE","READY_FOR_INDEPENDENT_REVIEW","UNDER_INDEPENDENT_REVIEW","AWAITING_ADJUDICATION","ADJUDICATED_GOLD","BLOCKED_FOR_INTAKE"]},"metadata_field":{"type":["string","null"]},"candidate_value":{"type":["string","null"]},"candidate_intent":{"type":["string","null"]},"expected_abstention":{"type":["boolean","null"]}},"allOf":[{"if":{"properties":{"risk_stratum":{"const":"A"},"review_status":{"const":"ADJUDICATED_GOLD"}},"required":["risk_stratum","review_status"]},"then":{"properties":{"authorization_status":{"const":"AUTHORIZED_LOCAL_EVALUATION"},"evidence_snapshot_sha256":{"pattern":"^[A-Fa-f0-9]{64}$"},"reviewer_ids":{"minItems":2,"maxItems":2,"uniqueItems":true},"completed_reviews":{"minItems":2,"maxItems":2},"adjudicator_id":{"type":"string","minLength":1}},"required":["reviewer_ids","completed_reviews","adjudicator_id"]}},{"if":{"properties":{"review_status":{"enum":["READY_FOR_INDEPENDENT_REVIEW","UNDER_INDEPENDENT_REVIEW"]}},"required":["review_status"]},"then":{"required":["metadata_field","candidate_intent","expected_abstention"],"anyOf":[{"properties":{"candidate_value":{"type":"string","minLength":1}},"required":["candidate_value"]},{"properties":{"expected_abstention":{"const":true}},"required":["expected_abstention"]}]}}],"additionalProperties":false}},"notes":{"type":"string"}},"allOf":[{"if":{"properties":{"status":{"const":"ADJUDICATED_GOLD"}},"required":["status"]},"then":{"properties":{"catalog_contract_sha256":{"pattern":"^[A-Fa-f0-9]{64}$"},"cases":{"items":{"properties":{"review_status":{"const":"ADJUDICATED_GOLD"}},"required":["review_status"]}}}}}],"additionalProperties":false}
