{
  "intake_version": "0.7.0-candidate-003",
  "status": "BLOCKED_FOR_INTAKE",
  "golden_set_version": "0.2.0-stratum-a",
  "catalog_contract_version": "dspace-cataloger-v3.6",
  "catalog_contract_sha256": "REPLACE_CATALOG_CONTRACT_SHA256",
  "cases": [
    {
      "case_id": "real-evidence-candidate-003-registered-language",
      "risk_stratum": "A",
      "bindings_under_review": ["registered-language"],
      "authorization_status": "AUTHORIZED_LOCAL_EVALUATION",
      "evidence_location_mode": "REPOSITORY_FIXTURE",
      "evidence_locator": "apps/api/tests/golden/llm-evidence/human-review/snapshots/real-evidence-candidate-003.txt",
      "evidence_snapshot_sha256": "f4baeb9fea9e552969532cd5de9f7eaee072590c6505203f66087dfa5b22f3c5",
      "reviewer_ids": ["cataloger-a", "cataloger-b"],
      "completed_reviews": [
        {
          "review_id": "review-real-evidence-candidate-003-registered-language-cataloger-a-v1",
          "reviewer_id": "cataloger-a",
          "case_id": "real-evidence-candidate-003-registered-language",
          "binding_id": "registered-language",
          "evidence_snapshot_sha256": "f4baeb9fea9e552969532cd5de9f7eaee072590c6505203f66087dfa5b22f3c5"
        },
        {
          "review_id": "review-real-evidence-candidate-003-registered-language-cataloger-b-v1",
          "reviewer_id": "cataloger-b",
          "case_id": "real-evidence-candidate-003-registered-language",
          "binding_id": "registered-language",
          "evidence_snapshot_sha256": "f4baeb9fea9e552969532cd5de9f7eaee072590c6505203f66087dfa5b22f3c5"
        }
      ],
      "adjudicator_id": null,
      "review_status": "BLOCKED_FOR_INTAKE"
    },
    {
      "case_id": "real-evidence-candidate-003-registered-language-rereview-v2",
      "risk_stratum": "A",
      "bindings_under_review": ["registered-language"],
      "authorization_status": "AUTHORIZED_LOCAL_EVALUATION",
      "evidence_location_mode": "REPOSITORY_FIXTURE",
      "evidence_locator": "apps/api/tests/golden/llm-evidence/human-review/snapshots/real-evidence-candidate-003.rereview-v2.packet.txt",
      "evidence_snapshot_sha256": "2a1ceef24ef537796ed5ec44dc7682a8b900964fd9ea70b9647404ad54817f81",
      "reviewer_ids": ["cataloger-a", "cataloger-b"],
      "completed_reviews": [
        {
          "review_id": "review-real-evidence-candidate-003-registered-language-cataloger-a-rereview-v2",
          "reviewer_id": "cataloger-a",
          "case_id": "real-evidence-candidate-003-registered-language-rereview-v2",
          "binding_id": "registered-language",
          "evidence_snapshot_sha256": "2a1ceef24ef537796ed5ec44dc7682a8b900964fd9ea70b9647404ad54817f81"
        },
        {
          "review_id": "review-real-evidence-candidate-003-registered-language-cataloger-b-rereview-v2",
          "reviewer_id": "cataloger-b",
          "case_id": "real-evidence-candidate-003-registered-language-rereview-v2",
          "binding_id": "registered-language",
          "evidence_snapshot_sha256": "2a1ceef24ef537796ed5ec44dc7682a8b900964fd9ea70b9647404ad54817f81"
        }
      ],
      "adjudicator_id": "adjudicator-1",
      "review_status": "BLOCKED_FOR_INTAKE"
    }
  ],
  "notes": "The original review cycle remains immutable and blocked. The v2 re-review was completed by two independent reviewers and a real human adjudication decision was recorded by adjudicator-1: ACCEPT_WITH_MINOR_EDIT, final value Purépecha, no abstention, no error codes. The adjudication artifact must remain TEMPLATE rather than FINAL because catalog_contract_sha256 is still unmaterialized. The case is therefore BLOCKED_FOR_INTAKE pending a frozen real catalog-contract SHA-256; ADJUDICATED_GOLD remains unauthorized."
}
